{
  "schema_version": 1,
  "id": "x360-vg-exp0014-evdev-individual-host-run",
  "kind": "virtual_host_run",
  "status": "passed",
  "sources": [
    "vg-alpha1-exp0014"
  ],
  "fixtures": [],
  "procedure": "Historical documentary-only observation; no new lab execution or imported private raw captures. Linux 6.12.107 arm64, SDL 3.2.0 535d80b; HIDAPI disabled; three sequential Xbox standard evdev sessions with IDs 7,7,65543.",
  "semantic_outcome": "156 exact button/axis endpoint and neutral observations; three successful removals. Initial trigger held before readiness produced startup calibration artifact; exclude it."
}
