{
  "schema_version": 1,
  "id": "ds-vg-exp0011-evdev-sdl-host-run",
  "kind": "virtual_host_run",
  "status": "passed",
  "sources": [
    "vg-alpha1-exp0011"
  ],
  "fixtures": [],
  "procedure": "Historical documentary-only observation; no new lab execution or imported private raw captures. Linux 6.12.107 arm64, SDL 3.2.0 535d80b, HIDAPI disabled, three ten-second DualSense uinput/evdev sessions.",
  "semantic_outcome": "3/3 SDL standard controls, neutral and conventional rumble with native evdev mapping version 0x8111; separate touch association and auxiliary buttons unvalidated."
}
