{
  "schema_version": 1,
  "id": "wii-w9g-dolphin-motionplus-nunchuk-on-host-run",
  "kind": "virtual_host_run",
  "status": "passed",
  "sources": [
    "wii-w9g-activation-codec-source",
    "wii-w8-dolphin-2503-input",
    "wii-gap-plustrace-dolphin-ciface-3eb"
  ],
  "fixtures": [
    "wii-w9g-dolphin-motionplus-nunchuk-on-host"
  ],
  "procedure": "First pass the bound kernel/xwiimote regression with activation compat on. Owner runs the brief ignore-special creation window and exact-owned grants, restoring 0 before consumers. Revalidate generic binding and no foreign holders. Run native Dolphin 2503 for 180 seconds in a fresh isolated emulated ControllerInterface profile with correct signed Nunchuk stick input names and imported caller calibration. Inspect owned motion/extension mapping views independently from native transport traces. Run activation-off and F6-mirror-off controls only after the on arm passes. Close each owned consumer before the next arm; finally close all devices idempotently and verify removal.",
  "semantic_outcome": "With generic binding, re-attach compat and both shims on, native Dolphin 2503 re-sends report mode after mapping, reads F6 including fixed F7=0x02, obtains imported MP and child calibration, and displays changing decoded gyro and Nunchuk stick for the bounded 180-second arm. Native post-map A400F0=55 count is zero. Scope is virtual Original with hid-wiimote not bound, test/dev under #258; not game, radio, physical, release or Plus acceptance."
}
