{
  "schema_version": 1,
  "id": "x360-vg-exp0009-uhid-sdl-host-run",
  "kind": "virtual_host_run",
  "status": "passed",
  "sources": [
    "vg-alpha1-exp0009"
  ],
  "fixtures": [],
  "procedure": "Historical documentary-only observation; no new lab execution or imported private raw captures. Linux 6.12.105 arm64, SDL 3.2.0 pinned 535d80b; three sequential 10-second standard HID/UHID sessions after axis descriptor correction.",
  "semantic_outcome": "3/3 controls, neutral, cleanup; initial mismatched-axis failure occurred before the corrected accepted runs. No XInput, xpad driver, Xbox HID rumble, motion or physical Xbox."
}
