{
  "schema_version": 1,
  "id": "wii-w9g-kernel-motionplus-host-run",
  "kind": "virtual_host_run",
  "status": "passed",
  "sources": [
    "wii-w9g-activation-codec-source",
    "wii-gap-plustrace-linux-core-v612",
    "wii-gap-plus-kernel-modules-v612",
    "wii-gap-plustrace-xwiimote-core-4df"
  ],
  "fixtures": [
    "wii-w9g-kernel-motionplus-host"
  ],
  "procedure": "Create two exact-owned Original virtual devices at published W9g runtime with imported caller synthetic calibration, default-on activation re-attach and shims. Keep wiimote bound, await owner grants and revalidate HID identity/linkage/access. Capture evtest and xwiimote concurrently for 18 seconds with a read-only exact-owned raw status tap. Separate post-map first 18 seconds from reader-close output writes. Close consumers and both virtual devices idempotently, verify HID/raw/LED disappearance before preparing any generic window.",
  "semantic_outcome": "Original motionplus, wiimote bound, activation re-attach compat on: all three evdev gyro axes and same-capture xwiimote MotionPlus events change between two driven values during the bounded 18-second reader run. Mapped mode 04. No A400F0=55 or A600F0=55 in the first 18 seconds after mapping; re-initialisation starts at reader close, over 18 seconds after mapping. Initial MP-only activation has a single plugged status, with a separate solicited status. This is a virtual software regression, not physical fidelity, rate acceptance or kernel decoded child acceptance."
}
